{"active_limit":3,"aliases":[],"catalog_id":"loki-framework-inferences","entries":[{"inference_id":"canonical-pwd-consumer-root","locator":"catalogs/loki-framework/records/canonical-pwd-consumer-root/rev-1.json","objectives":["consumer-root-resolution","interface-simplicity"],"revision":1,"signals":["command-starts-at-project-root","installed-in-consumer"],"status":"active","summary":"Resolve consumer state from canonical pwd; do not request consumer_root.","surfaces":["analytic-inference-state","command-interface"],"technologies":["loki-framework"]}],"schema_version":1,"technology":"loki-framework"}
